271004,,大阪府,大阪市,安居神社,ヤスイジンジャ,,,天王寺区逢阪１丁目３−２４,,34.654529,135.511014,,,,,,,少彦名神(すくなひこなのかみ)、菅原道真を祀る古社。昌泰4年（901年）菅原道真が太宰府に左遷された際、河内の道明寺にいた伯母覚寿尼（かくじゅに）を訪ねて行く途中、ここへ立ち寄って安井（休憩）した。当時、道真に同情した村人がおこしを差し上げると、お礼にと菅原家の紋所「梅鉢」を渡した。これが、今でも大阪名物の「粟おこし」の商標の梅鉢となったといわれている。安居天神社は、その道真の死後の天慶5年（942年）、道真の霊を祀るために村人たちが建てたもの。当地は四天王寺の僧侶がここで夏安居（げあんご：雨季の間に外出を控え寺院で修行に専念すること）することもあり、「安井」が「安居」になったという。また、享保11年（1726年）、大丸の業祖下村彦右衛門氏が、社殿の破損荒廃の甚だしい事を嘆き修理するなど、歴代大丸店主の神社に対する信仰は篤く、世に大丸天神と称せられる所以である。境内には、道真も口にしたといわれる天王寺七名水のひとつ「かんしづめ（癇鎮め）の井」のほか、大坂夏の陣で徳川方に討たれて戦死した真田幸村の祈念碑銅像が建つ。,,,,,安居神社,,,,,,文化・観光/都市景観資源
271004,,大阪府,大阪市,一心寺三千佛堂,イッシンジサンゼンブツドウ,,,天王寺区逢阪２丁目６−１３,,34.652671,135.511803,,,,,,,一心寺に参詣される善男善女のために開かれた講堂として、平成14年（2002年）5月に建立された。この内部、大回廊に、千躰の佛様—「千躰佛」を21世紀中かけて順次造立奉安されていく予定である。,,,,,一心寺三千佛堂,,,,,,文化・観光/都市景観資源
271004,,大阪府,大阪市,清寿院（関帝廟）,セイジュイン（カンテイビョウ）,,,天王寺区勝山２丁目６−１５,,34.653915,135.520311,,,,,,,「三国志」の英雄関羽を祀り、正式には黄檗（おうばく）宗白駒山清寿院と言われる。中国との縁が深いため南京寺と通称されている。明和元年（1764年）12月、浄土宗住職宗円より黄檗僧大肩和尚が譲り受け、中国僧大成和尚を中興開山となし、本堂を再建して黄檗宗の末寺となった。「摂津名所図会大成」には、藁葺きの表門や一対の摩伽羅（想像上の大魚）を載せた入母屋の本堂などをうかがうことができる。明治18年（1885年）に、長崎から来阪した広東華商の利興成・同孚泰の両貿易商が発起人となり、日本人取引業者を含めた篤志家（とくしか）とともに本堂・拝所・表門等が中国風に改築された。大坂の文化人木村蒹葭堂との交流が盛んであったと、「蒹葭堂日記」に開山禅師をはじめとした交流が綴られている。,,,,,清寿院（関帝廟）,,,,,,文化・観光/都市景観資源
271004,,大阪府,大阪市,真田山公園前の道,サナダヤマコウエンマエノミチ,,,天王寺区真田山町、玉造本町付近,,34.671353,135.528046,,,,,,,真田山公園の北側の坂道は、真田山町と玉造本町との間の道を西へ入り、餌差町（えさしまち）の伝長寺前まで約330ｍつづいている。真田山公園の地には、もと騎兵第四連隊があり、昭和7年（1932年）に移転した跡地が公園となった。公園北の坂道も騎兵隊移転後に整備されたものである。上町台地に点在する文化遺産や貴重な史跡の景観を楽しみながら散策できるみちづくりの１つである「坂道」整備により、この石畳の道も昭和59年～60年（1984年～1985年）に整備された。,,,,,真田山公園前の道,,,,,,文化・観光/都市景観資源
271004,,大阪府,大阪市,真田山公園,サナダヤマコウエン,,,天王寺区真田山町５,,34.669853,135.528138,,,,,,,騎兵第四連隊の跡地に、昭和14年（1939年）8月に開設した。戦後、占領軍に一時期接収されたが、昭和23年（1948年）に運動公園として再開園し、現在は、天王寺スポーツセンターや真田山プール（屋外50m、冬季はアイススケートリンク）、野球場、テニスコートなどの施設を備えた総合スポーツ公園として多くの市民に活用されている。,,,,,真田山公園,,,,,,文化・観光/都市景観資源
271004,,大阪府,大阪市,お寺のまち・下寺町と斜面緑地,オテラノマチ・シタデラマチトシャメンリョクチ,,,天王寺区下寺町１丁目・2丁目付近,,34.660962,135.511749,,,,,,,坂道や眺望点など、上町台地は大阪市内では珍しく地形変化を楽しめる場所であるが、なかでも延長2キロ近くの樹林帯が南北方向に連なっている「夕陽丘」は貴重である。下寺町には、昭和4年（1929年）に建設され、国の登録有形文化財に指定されている心光寺の本堂や、天正19年（1550年）開基足利尊氏で、足利家の祈願所で近畿の名刹であったと言われている大蓮寺などがある。,,,,,お寺のまち・下寺町と斜面緑地,,,,,,文化・観光/都市景観資源
271004,,大阪府,大阪市,学園坂,ガクエンザカ,,,天王寺区下寺町1丁目・2丁目付近,,34.660058,135.511556,,,,,,,天王寺区下寺町・松屋町筋から谷町筋六万体へ通ずる坂は、上町台の中央を南北に分断するような大きな坂である。かつて小さな道を切り開いて自動車道路として造られたものである。その後、道沿いに大阪女子学園（現在大阪夕陽丘学園）ができて学園坂とよばれるようになった。,,,,,学園坂,,,,,,文化・観光/都市景観資源
271004,,大阪府,大阪市,四天王寺西門前の参道,シテンノウジサイモンマエノサンドウ,,,天王寺区四天王寺１丁目１１,,34.653655,135.514389,,,,,,,四天王寺西門前の石畳の道であり、参道上に立つ西門前の石鳥居は国の重要文化財に指定されている。石鳥居から西門までの沿道には店舗や露店等が並んでいる。四天王寺西門は、浄土信仰のうえで日想観の聖地として位置付けられる特別な土地であり、平安時代以降、様々な階層の人々から厚い信仰を集めてきた。石鳥居はその象徴的な存在で、現世から西方浄土への入口としての役割を負う建造物である。なお、参道については、四天王寺の参道にふさわしい、にぎわいと雰囲気づくりを目的に大阪市の修景事業により整備が行われている。,,,,,四天王寺西門前の参道,,,,,,文化・観光/都市景観資源
271004,,大阪府,大阪市,大阪市立大江幼稚園,オオサカシリツオオエヨウチエン,,,天王寺区四天王寺１丁目１１−１０８,,34.656166,135.515456,,,,,,,昭和5年（1930年）7月17日開設。平成22年（2010年）に、80周年を迎え、園舎は、戦災や災害に耐え、木造平屋建て瓦ぶき屋根の、歴史と伝統の重みと懐かしさを残している。園庭には、桜や藤などの樹木やブドウやミカン、モモ等の実のなる木があり、花壇には四季折々の花が咲く。,,,,,大阪市立大江幼稚園,,,,,,文化・観光/都市景観資源
271004,,大阪府,大阪市,U氏邸,ユウシテイ,,,天王寺区清水谷町７−９,,34.674353,135.521561,,,,,,,打ち放しの外観に、豊富な植栽が良く映える。昭和43年（1968年）に職住一体都市住宅のさきがけとして建築された。緑に被われたファサードは年月を重ねるごとに豊さを増している。日本の現代建築に大きな影響を与えた建築家・西澤文隆による設計。平成19年（2007年）には、NPO法人屋上開発研究会大阪支部が主催する「第1回屋上開発・関西さきがけ賞」の大賞を受賞した。,,,,,U氏邸,,,,,,文化・観光/都市景観資源
271004,,大阪府,大阪市,鶴橋駅周辺の焼肉店の多い街並み,ツルハシエキシュウヘンノヤキニクテンノオオイマチナミ,,,天王寺区下味原町１～５,,34.665661,135.529436,,,,,,,天王寺区には鶴橋西商店街があり、ここ数年で焼き肉店が増えたことから“焼肉スクウェア”と呼ばれている。この商店街の風景は、焼肉店やキムチなどの食材を扱う店などが建ち並び、焼き肉の香ばしいかおりやキムチなどの独特なかおりが広範囲にわたって漂っていることから、環境省のかおり100選に選ばれている。,,,,,鶴橋駅周辺の焼肉店の多い街並み,,,,,,文化・観光/都市景観資源
271004,,大阪府,大阪市,楞嚴寺,リョウゴンジ,,,天王寺区城南寺町１−２６,,34.67085,135.52346,,,,,,,慶長2年(1597年)僧禅牛の開創である。楞嚴寺には織田作の名で親まれ、『夫婦善哉』のように大阪を舞台として、市井に生きる人びとをいきいきと描いた作品を数多く残した「織田作之助」の墓所がある。,,,,,楞嚴寺,,,,,,文化・観光/都市景観資源
271004,,大阪府,大阪市,總本家釣鐘屋,ソウホンケツリガネヤ,,,天王寺区大道１丁目５−２,,34.653247,135.514137,,,,,,,明治33年（1900年）、地元の有志から四天王寺に大梵鐘が奉納され、大阪商人の心意気を示す快挙として評判になった。その奉納記念として、釣鐘のかたちを模した饅頭を、四天王寺の門前で売り出したのが「釣鐘まんじゅう」のはじまりである。店舗の屋根につけられた鐘などレトロな外観が、100年以上つづく店舗の歴史を感じさせる。,,,,,總本家釣鐘屋,,,,,,文化・観光/都市景観資源
271004,,大阪府,大阪市,超願寺（竹本義太夫の墓）,チョウガンジ（タケモトギダユウノハカ）,,,天王寺区大道１丁目１４−１,,34.6514043,135.5159658,,,,,,,義太夫節浄瑠璃の元祖といわれ、慶安（けいあん）4年（1651年）この付近（堀越（ほりこし）神社南約100mの路上に、生誕地碑）に生まれた。若いころから研究熱心で小唄・俗謡から物売りの呼声まで身につけ、将来に備えた。その後京・大坂で修業を積み、延宝（えんぽう）5年（1677年）に独立、作者に近松門左衛門を迎え、その他、三味線・人形の名手、経済面での協力者を得て「曽根崎心中」で大当たりをとった。お墓は、超願寺境内にあり、お堂の状態で雨風から守られている。,,,,,超願寺（竹本義太夫の墓）,,,,,,文化・観光/都市景観資源
271004,,大阪府,大阪市,三光神社,サンコウジンジャ,,,天王寺区玉造本町１４−９０,,34.672972,135.529377,,,,,,,明治41年（1908年）境内の全国唯一の中風除けの神、三光宮を合祀してより三光神社と呼ばれるようになった。毎年6月1日から7日まで中風祈願大祭が行われ、全国各地から多くの参拝者が訪れる。古くから三光神社の地に真田の抜け穴の話が伝えられている。慶長19年(1614年)の大坂の合戦の頃、真田幸村がこの地に偃月城（えんげつじょう）と名付ける塁を築き、大坂城まで通じる暗道を造ったと言い伝えられており、今も「真田の抜け穴」として保存されており、境内には昭和62年（1987年）に建立された真田幸村の銅像がある。,,,,,三光神社,,,,,,文化・観光/都市景観資源
271004,,大阪府,大阪市,天王寺公園・天王寺動物園,テンノウジコウエン・テンノウジドウブツエン,,,天王寺区茶臼山町,,34.6500407,135.5086863,,,,,,,明治36年（1903年）の第5回内国勧業博覧会の跡地利用として東半分を公園にしたもので、明治42年（1909年）に開設された長い歴史をもつ。昭和62年（1987年）に、開催された天王寺博覧会を契機に水と緑をふんだんに取り入れた公園へと一新され、沈床花壇や小川の小径、バラのアーチなど見どころも多彩である。また、公園内には昭和8年（1933年）に大阪市に寄贈された旧黒田藩藏屋敷長屋門（大阪府有形文化財、大阪市顕彰史跡）や作品「めし」の一節を刻んだ林芙美子文学碑なども設置されている。動物園に関しては、大正4年（1915年）1月に日本で3番目の動物園として開園した。約11haの園内におよそ200種、900点の動物が飼育されており、年間120万人以上の利用者で賑わっている。,,,,,天王寺公園・天王寺動物園,,,,,,文化・観光/都市景観資源
271004,,大阪府,大阪市,慶沢園,ケイタクエン,,,天王寺区茶臼山町,,34.649732,135.511261,,,,,,,もと住友本邸の庭で、美術館の敷地とともに大阪市へ寄贈されたものであり、10年余りの歳月を要して完成した純日本風の回遊式庭園である。明治41年（1908年）、庭師小川治兵衛が作り、伏見宮貞愛親王が慶沢園と命名した。,,,,,慶沢園,,,,,,文化・観光/都市景観資源
271004,,大阪府,大阪市,茶臼山・河底池・和気橋,チャウスヤマ・カワゾコイケ・ワケバシ,,,天王寺区茶臼山町,,34.651312,135.511615,,,,,,,大坂冬の陣で家康の本陣となり、夏の陣では幸村が布陣し激戦地となった茶臼山は、奈良時代に和気清麻呂（わけのきよまろ）が河内川の流水を南に引こうとした河底池とともに、天王寺公園の風景に取り入れられている。和気橋は、延暦７年（788年）和気清麻呂が旧大和川の流れを変えるために上町台地を開削した際、茶臼山古墳の濠を利用した名残が河底池であると伝えられていることから、「和気橋」と名付けられている。,,,,,茶臼山・河底池・和気橋,,,,,,文化・観光/都市景観資源
271004,,大阪府,大阪市,堀越神社,ホリコシジンジャ,,,天王寺区茶臼山町１−８,,34.651418,135.513386,,,,,,,聖徳太子が、叔父に当たる第３２代崇峻天皇の徳を偲んで、四天王寺建立と同時に当社を創建したものである。古くより明治の中期まで、境内の南沿いに美しい堀があり、この堀を越えて参詣したので、堀越という名が付けられたといわれている。境内にかえる石が蹲（つくばい）のすぐ横に高さ50㎝ほど、三角錐の形で鎮座しており、無事帰る、福返ると伝えられている。,,,,,堀越神社,,,,,,文化・観光/都市景観資源
271004,,大阪府,大阪市,大阪市立美術館,オオサカシリツビジュツカン,,,天王寺区茶臼山町１−８２,,34.649723,135.5103171,,,,,,,昭和11年（1936年）5月開館。美術館は天王寺公園の中に位置しているが、その敷地は住友家の本邸であったところで、美術館の建設を目的に庭園（慶沢園）とともに、大阪市に寄贈されたものである。美術館は設立当初の本館と、平成4年（1992年）に美術館正面地下に新設した地下展覧室からなり、本館陳列室では、特別展覧会や常設展示を開催している。,,,,,大阪市立美術館,,,,,,文化・観光/都市景観資源
271004,,大阪府,大阪市,四天王寺庚申堂,シテンノウジコウシンドウ,,,天王寺区堀越町２−１５,,34.650279,135.515971,,,,,,,四天王寺の数百メートル南にある庚申堂の縁起は、今から1300余年前（飛鳥時代）、我が国に色々の疫病がはやり、四天王寺の民部（みんぶ）の郷僧都毫範（そうずごうはん）が、霊験を得て祈願をしたとき、庚申堂の本尊である青面金剛童子（しょうめんこんごうどうじ）が、16歳くらいの童子の姿で現れ、毫範に除災無病の力を与え、それによって病は去っていったという言い伝えがあり、時は大宝元年（701年）正月7日、庚申の日とされる。以来、毫範の感得した青面金剛童子をこの地で祀られたのを開基とする。我が国の庚申信仰の始まりであり、以来庚申本尊を祀ろうとするものは、皆当寺に来て、免許を得、尊天の分身を勧請（かんじょう）するのを例としている。本堂は元和４年（1618年）建立されたお堂であったが、昭和20年(1945年)の空襲で焼失し、現在の建物は、昭和45年（1970年）大阪万博に造られた休憩所・法輪閣を移築したものである。,,,,,四天王寺庚申堂,,,,,,文化・観光/都市景観資源
271004,,大阪府,大阪市,大正湯の煙突,タイショウユノエントツ,,,天王寺区松ケ鼻町３−１６,,34.660477,135.523648,,,,,,,夕陽丘高校の東側の道を北へ入った閑静な住宅街の中にある。狭い空間をうまく開放感と質感をもつ雰囲気に仕立てた設計(昭和56年（1981年)）となっている。,,,,,大正湯の煙突,,,,,,文化・観光/都市景観資源
271004,,大阪府,大阪市,伝藤原家隆墓,デンフジワライエタカハカ,,,天王寺区夕陽丘町５,,34.658134,135.512527,,,,,,,藤原家隆（1158年～1237年）は、藤原時代末期の五代の天皇に仕えた有名な歌人で、79歳の時に官を辞して浄春寺の地に隠棲（いんせい）した。その翌年の春の彼岸に高台から西の海に落ちる夕日を見て、その荘厳さに心を打たれ直ぐに落髪して仏性と号し、その4月9日に消えるように一生を終えた。伝藤原家隆墓は、家隆の墓といわれ、その傍らには、御影石にこの歌が夕日とともに刻まれた歌碑がある。夕陽丘の地名は、この歌の「波の入日」からきている。,,,,,伝藤原家隆墓,,,,,,文化・観光/都市景観資源
271004,,大阪府,大阪市,愛染堂（愛染さん）,アイゼンドウ（アイゼンサン）,,,天王寺区夕陽丘町５−３６,,34.657269,135.512576,,,,,,,推古天皇元年（593）、四天王寺の施薬院（せやくいん）として聖徳太子が建立し、その後、縁結びの神様として有名な愛染明王が本尊として祀られるようになったことから「愛染堂」と呼ばれるようになった。「愛染めの霊水」は飲むと愛が叶うと言われ、映画「愛染かつら」のモデルとなったことで知られる愛染かつらの霊木が境内にある。本堂（金堂）は大阪府の指定文化財、多宝塔は大阪市内最古の木造建築物で国の重要文化財の指定を受けている。毎年6月30日～7月2日に行われる「愛染まつり」は、大阪三大夏祭りのひとつといわれ、大阪に夏の訪れを告げる風物詩として広く知られる。愛染明王のご開帳が行われ、夜店も立ち並ぶのでたくさんの参詣者で賑わう。,,,,,愛染堂（愛染さん）,,,,,,文化・観光/都市景観資源
271004,,大阪府,大阪市,大江神社,オオエジンジャ,,,天王寺区夕陽丘町５−４０,,34.657128,135.512044,,,,,,,天王寺七宮の１つで、聖徳太子自らまつりごとを行ったこともあり四天王寺の鎮守といわれている。四天王寺の乾（いぬい　西北）に位置しているところから、江戸時代には「乾社」と呼ばれていた。当時は毘沙門天(びしゃもんてん）を祀っていたので、「毘沙門堂」とも呼ばれていた。その守護獣（おつかい）は虎なので、「狛犬」ならぬ「狛虎」が座し、阪神タイガースファンの参拝が後を絶たない。また、大江神社に向かう段丘崖の階段は、「百歳（ももとせ）の階段」と呼ばれている。「大江」の社号は慶応3年（1867年）に、この地は西側が傾斜地になっており、その昔大江の岸と称していたので、時の祀官（しかん）が改称した。当社は天王寺北村の産土神であり、祭社主神に豊受大神を祀り、稲荷神と同一神で五穀豊穣、食料保持の神である。,,,,,大江神社,,,,,,文化・観光/都市景観資源
271004,,大阪府,大阪市,清水寺,キヨミズデラ,,,天王寺区伶人町５−８,,34.655296,135.511406,,,,,,,かつては有栖寺（ありすでら）といってかなり古くからあったといわれる。寛永17年(1640年)に延海大阿闍梨（えんかいだいあじゃり）が観世音菩薩（かんぜおんぼさつ）のお告げをうけ、京都の清水寺から聖徳太子の作といわれる十一面千手観世音菩薩（せんじゅかんのんぼさつ）を遷して本尊として祀り、享保年間(1716年～1736年)に新清水寺に寺号を変えたとされている。墓地の西端には、もともとの眺望性を活かして京都の清水寺を模した「舞台」があり、市街地が展望でき、大阪南のシンボルである通天閣等も見える。,,,,,清水寺,,,,,,文化・観光/都市景観資源
271004,,大阪府,大阪市,吉祥寺（赤穂義士の寺）,キッショウジ（アコウギジノテラ）,,,天王寺区六万体町１−２０,,34.660314,135.514925,,,,,,,寛永7年（1630年）創建の曹洞宗の寺院であり、創建当時の住職縦鎌師が赤穂藩主浅野主匠頭長矩（あさの たくみのかみ ながのり）と親しい間柄で、この寺は大坂における浅野家の菩提寺であった。義士討ち入りの翌年2月、大石内蔵助をはじめとする46士は切腹したが、足軽の寺坂吉右衛門が46士の遺髪、遺爪、鎖かたびら等に銀10両を添えて義士の冥福を祈る碑を建ててくれるよう吉祥寺に依頼したもので、江戸や赤穂よりも先がけ、元文4年（1739年）建立されたという。しかし、昭和20年（1945年）３月の大阪大空襲で義士の遺品など全て灰燼（かいじん）に帰し、残るのは墓石のみであった。この寺の山門は元は中之島常安橋北詰にあった赤穂藩蔵屋敷門を移築したものであったが、戦災で焼失したため再建された。,,,,,吉祥寺（赤穂義士の寺）,,,,,,文化・観光/都市景観資源
271004,,大阪府,大阪市,大阪ガス 実験集合住宅　ＮＥＸＴ21,オオサカガスジッケンシュウゴウジュウタクネクストニジュウイチ,,,天王寺区清水谷町６−１６,,34.674926,135.521636,,,,,,,「ゆとりある生活と省エネルギー・環境保全の両立」をテーマに、近未来の都市型集合住宅のあり方を提案することを目的として、大阪ガス(株)が平成5年（1993年）10月に建設した実験集合住宅である。竣工以来、平成6年（1994年）4月、平成12年（2000年）4月、平成19年（2007年）4月から各5年間にわたり、それぞれ時代を見通したテーマを設定し、大阪ガス社員とその家族が実際に居住しながら、計3回15年間の実証実験が取り組まれてきた。平成25年（2013年）6月からは「第4フェーズ」として、「環境にやさしい心豊かな暮らし」をテーマに、人と人のつながりの創出、人と自然の関係性の再構築、省エネ・スマートな暮らしの実現を満たすべき要件と捉え、それらを具現化する、「住まい」および「エネルギーシステム」の2分野の実証実験が実施されている。樹木も多く配置され、周辺の住民の方々からも親しまれている建物である。,,,,,大阪ガス 実験集合住宅　ＮＥＸＴ21,,,,,,文化・観光/都市景観資源
271004,,大阪府,大阪市,安威川と番田水路に挟まれた散歩道,アイガワトバンダスイロニハサマレタサンポミチ,,,東淀川区井高野１丁目、3丁目、4丁目,,34.761279,135.540701,,,,,,,安威川河川敷は、「安威川水と緑の回廊計画」の一環として、公園や遊歩道などが連続的に整備されており、潤いのある水辺空間として散策を楽しんだり環境美化活動に参加するなど地域の方々に親しまれている。,,,,,安威川と番田水路に挟まれた散歩道,,,,,,文化・観光/都市景観資源
