271004,,大阪府,大阪市,京阪ビルとOMMビル,ケイハンビルトオーエムエムビル,,,中央区大手前1丁目7、天満橋京町,,34.6902458,135.5169698,,,,,,,上段の写真：昭和44年(1969)撮影・中段の写真：平成23年撮影・下段の写真：昭和45年撮影 ◇◇ 京阪ビルディング(写真の手前)は、Ⅰ期が昭和38年、Ⅱ期が同41年に完成した鉄筋コンクリート造8階建のビルで、京阪天満橋駅、松坂屋・商業施設と旅行会館(のちのキャッスルホテル)。そののち松坂屋は平成16年に撤退し、同17年、外装改修し京阪シティモールがオープンした。一方の、大阪マーチャンダイズマート(OMM)ビル(写真の奥側)は、日本最初の卸センタービルとして、旧京阪天満橋駅跡地に昭和44年に完成オープンした22階建ビルである。そののち、平成元年に外装の全面カーテンウォール化改修を行い外観が一変している。,,,,,京阪ビルとOMMビル,,,,,,文化・観光/大阪の昔と今
271004,,大阪府,大阪市,港大橋の建設工事,ミナトオオハシノケンセツコウジ,,,港区海岸通3丁目,,34.645116,135.4383771,,,,,,,上段の写真：昭和49年(1974)撮影・中段の写真：平成23年撮影・下段の写真：昭和59年撮影 ◇◇ 港区天保山と住之江区南港を結び、大阪湾岸線の一部を形成する、世界最大級の3径間ゲル—トラス橋(全長980m)で、大型コンテナ船が航行できるよう水面からの桁下高51.5mの長大橋である。写真は昭和49年2月に行われた長さ186m・高さ22.5mの中央部桁の取付工事。同年7月に開通し、上下2層のダブルデッキになっており、上段が阪神高速道路の大阪港線、下段が湾岸線である。赤く塗装された巨大橋は圧倒的な存在感で、大阪港のシンボルとなっている。のち、平成7年の阪神大震災では一部損傷もあり、同14～19年度に耐震補強工事を行っている。,,,,,港大橋の建設工事,,,,,,文化・観光/大阪の昔と今
271004,,大阪府,大阪市,埋立前の大野川,ウメタテマエノオオノガワ,,,西淀川区大和田,,34.7045023,135.4476215,,,,,,,上段の写真：昭和40年代前半撮影・中段の写真：平成23年撮影・下段の写真：昭和35年撮影 ◇◇ 西淀川区の大野川は、淀川北岸一帯がまだ農地であったころの川で、都市化の進行でどぶ川と化し、排水機能を失い、環境の悪化を招いていた。そのため、浸水対策と環境整備の両面から埋立計画がたてられ、幹線下水道を埋設した後、昭和45年から埋立・整備工事が開始された。大野川歩行者・自転車専用道は昭和54年に全線が開通し、緑陰歩道と自転車専用道が整備され、地域社会に直結した生活道路、あるいは緑の散歩道や、ランニングコースとして利用されている。,,,,,埋立前の大野川,,,,,,文化・観光/大阪の昔と今
271004,,大阪府,大阪市,西淀川区役所,ニシヨドガワクヤクショ,,,西淀川区御幣島1丁目2,,34.7113602,135.4562103,,,,,,,上段の写真：昭和32年(1957)頃撮影・中段の写真：平成23年撮影・下段の写真：昭和35年撮影 ◇◇ 西淀川区役所は、昭和32年、歌島橋交差点角に鉄筋コンクリート造3階建の庁舎が完成した。その後、老朽化にともない、平成17年に建替えられて、西淀川図書館と水道局サービスステーション、災害用備蓄倉庫併設の複合施設として、鉄骨鉄筋コンクリート造地下2階地上6階建の新庁舎が完成した。新庁舎は、平成9年に開通したJR東西線御幣島駅とつながる、サンクンガーデンを庁前広場に配置し、区民が憩える場としている。,,,,,西淀川区役所,,,,,,文化・観光/大阪の昔と今
271004,,大阪府,大阪市,中島大水道,ナカジマダイスイドウ,,,東淀川区西淡路5丁目,,34.7418128,135.5132656,,,,,,,上段の写真：昭和30年(1955)頃撮影・中段の写真：平成23年撮影・下段の写真：昭和35年撮影 ◇◇ 中島大水道は、度重なる水害と水はけの悪さに耐えかねた北中島22ヵ村の村民たちが、延宝6年(1678)に自力で開さくしたものである。そののち、水利組合から昭和18年に市に移管された。大水路はその後、機能低下や水質悪化のために埋め立てまたは暗渠化されて、東海道新幹線・十三バイパス用地などに利用されている。現在、西淡路5丁目の新幹線高架のそばに中島大水道顕彰碑が建てられている。,,,,,中島大水道,,,,,,文化・観光/大阪の昔と今
271004,,大阪府,大阪市,博愛社,ハクアイシャ,,,淀川区十三元今里3丁目1,,34.7219624,135.4760356,,,,,,,上段の写真：昭和30年(1955)頃撮影・中段の写真：平成23年撮影・下段の写真：昭和35年撮影 ◇◇ 博愛社は、明治23年に創立され、明治32年に現在の地に移転して、児童保護をはじめとして学校・乳児院・母子ホームなど、さまざまな社会事業を行ってきた。この聖贖主教会礼拝堂は、建築家のヴォーリズ設計で昭和11年に完成している。昭和27年、この地を本部とする社会福祉法人となってしだいに施設を拡充し、現在では、児童養護施設・保育園・特別養護老人ホーム・ケアハウス・介護サポートセンターなどの事業を行っている。,,,,,博愛社,,,,,,文化・観光/大阪の昔と今
271004,,大阪府,大阪市,府立北野高校,フリツキタノコウコウ,,,淀川区新北野2丁目5,,34.7156201,135.47804,,,,,,,上段の写真：昭和30年(1955)頃撮影・中段の写真：平成23年撮影・下段の写真：昭和17年撮影 ◇◇ 北野高校は、明治6年に設立された欧学校を前身とし、変遷して大阪府中学校・堂島中学校などと改称、さらに明治35年北野芝田町に移転して、府立北野中学校として長く北野の地にあった。その後、昭和6年に十三南之町(府立修徳館跡)に移転し、昭和23年学制改革によって府立北野高校となる。昭和37年・55年には校舎新館が完成、さらに、平成15年に校舎改築工事が完成している。,,,,,府立北野高校,,,,,,文化・観光/大阪の昔と今
271004,,大阪府,大阪市,鐘淵紡績中島工場,カネガフチボウセキナカジマコウジョウ,,,東淀川区東淡路1丁目,,34.7344278,135.5201061,,,,,,,上段の写真：昭和30年(1955)頃撮影・中段の写真：平成23年撮影・下段の写真：昭和35年撮影 ◇◇ 鐘淵紡績中島工場は、明治32年に、当時の西成郡西中島村に開業した。戦災をまぬがれ、戦後は新工場の増設とともに、紡織一貫工場として操業してきた。のちの繊維不況とともに工場は縮小・閉鎖され、東側跡地には、昭和50年頃から約800戸の大規模マンション(エバーグリーン淀川)が建設され、西側跡地には、昭和53年から住宅供給公社淡路コーポ、市営東淡路第2住宅、さらに平成5年に、市立女性いきいきセンター北部館(クレオ大阪北)、東淀川スポーツセンターなどが開設されている。,,,,,鐘淵紡績中島工場,,,,,,文化・観光/大阪の昔と今
271004,,大阪府,大阪市,淀川キリスト教病院,ヨドガワキリストキョウビョウイン,,,東淀川区淡路2丁目9,,34.7363601,135.5129099,,,,,,,上段の写真：昭和30年(1955)頃撮影・中段の写真：平成23年撮影・下段の写真：昭和35年撮影 ◇◇ 淀川キリスト教病院は、昭和30年に、当時医療環境に恵まれなかった淡路の地に、淀川キリスト教診療所として開設された。昭和35年に淀川キリスト教病院となり、その後のあいつぐ拡張によって、各診療科建物の分散・老朽化が課題となってきた。さらに都市計画道路事業による施設移転の必要もあり、昭和57年から改築を始め、平成14年に増改築による新病院が完成し、つづいて新施設も開設してきている。,,,,,淀川キリスト教病院,,,,,,文化・観光/大阪の昔と今
271004,,大阪府,大阪市,長柄橋,ナガラバシ,,,東淀川区柴島1丁目、北区天神橋8丁目,,34.7218904,135.5098471,,,,,,,上段の写真：大正期撮影・中段の写真：平成23年撮影・下段の写真：昭和17年撮影 ◇◇ 長柄橋は古来より有名であるが、詳細は明らかでなく、新淀川開さく後の明治42年、延長674mの鉄製のポニートラス橋が架けられた。さらに昭和11年には、十大放射道路事業の一つとしてすぐ下流側に幅員20m・橋長656mの橋に架け替えられ、同時に長柄可動堰が設置された。その後、昭和30年代に自動車交通が急激に増加し、長柄橋は市内随一の渋滞個所となり、混雑を解消するために、同39年にｂ字形曲線橋の長柄バイパスが完成した。さらに長柄橋も、淀川改修計画に沿って、昭和58年に中央部アーチ形式・橋長656mの新橋が開通した。(長柄橋と向こう側に見えているのが長柄バイパス),,,,,長柄橋,,,,,,文化・観光/大阪の昔と今
271004,,大阪府,大阪市,赤川鉄橋,アカガワテッキョウ,,,都島区大東町3丁目,,34.7307852,135.5267835,,,,,,,上段の写真：昭和38年(1963)頃撮影・中段の写真：平成23年撮影・下段の写真：昭和17年撮影 ◇◇ 昭和4年3月、城東貨物線の淀川橋梁が開通したが、当初単線運行とされて、線路の上流側の部分に、歩行者・自転車用として木造の赤川仮橋が設けられた。明治の新淀川開削により600mも隔てられることになった、両岸の住民の日常の生活動線として、地元では「赤川鉄橋」と呼ばれ親しまれてきた。現在事業中のおおさか東線により、淀川橋梁も旅客用に複線化されることになるが、歩行者橋の取り扱いについては、現段階では未定となっている。,,,,,赤川鉄橋,,,,,,文化・観光/大阪の昔と今
271004,,大阪府,大阪市,城北公園,シロキタコウエン,,,旭区生江3丁目29,,34.7296963,135.537289,,,,,,,上段の写真：昭和10年(1935)頃撮影・中段の写真：平成23年撮影・下段の写真：昭和17年撮影 ◇◇ 明治期の新淀川開さく後、旧中津川の蛇行部の河川敷が水面の多い空地となっていた部分を、公園として利用する工事が進められ、昭和9年5月に9.5haが城北公園として開設された。開設当時、園地の約3分の1は池で、園内には教材園・貸農園・温室・魚釣場などが設けられていた。戦後の再整備・拡張に際し、池の一部が埋め立てられたが、もとの池を利用して昭和39年に大規模な菖蒲園が設けられるなど、整備が進められて市民に親しまれている。,,,,,城北公園,,,,,,文化・観光/大阪の昔と今
271004,,大阪府,大阪市,城北市民病院,シロキタシミンビョウイン,,,旭区高殿6丁目14,,34.7174698,135.54608,,,,,,,上段の写真：昭和32年(1957)頃撮影・中段の写真：平成23年撮影・下段の写真：昭和35年撮影 ◇◇ 城北市民病院は、昭和28年12月、北東地域における中核病院として開設され、昭和52年からは全日救急医療も実施してきたが、医療施設の再編整備に伴い、平成5年に総合医療センターに統合された。跡地には、平成14年、おとしよりすこやかセンター北部館・旭屋内プール・城北市民学習センターの複合施設が建設され、8階建施設の上部は住宅供給公社のコーシャハイツ高殿となっている。,,,,,城北市民病院,,,,,,文化・観光/大阪の昔と今
271004,,大阪府,大阪市,毛馬洗堰,ケマアライゼキ,,,都島区毛馬町3丁目,,34.7201771,135.5173532,,,,,,,上段の写真：昭和40年(1965)撮影・中段の写真：平成23年撮影・下段の写真：昭和17年撮影 ◇◇ 新淀川の開削に伴って、明治43年に、新淀川から大川(旧淀川)の入り口部に設けられた洗堰・閘門。流量調節用の煉瓦造の「毛馬洗堰」と、写真の奥(右岸)は、水位差のある両川の船の通航のために、明治40年に完成した「毛馬閘門」と、大正7年に完成した第二閘門となっている。のち、昭和49年に大川左岸側に新しい「毛馬閘門」が完成し、昭和58年には新しく「毛馬水門」「毛馬排水機場」が完成した。なお旧閘門は昭和51年に廃止され、第一閘門旧跡(重要文化財に指定)周辺は、公園として整備されている。,,,,,毛馬洗堰,,,,,,文化・観光/大阪の昔と今
271004,,大阪府,大阪市,大阪大学工学部,オオサカダイガクコウガクブ,,,都島区東野田町4丁目15,,34.6993101,135.5288869,,,,,,,上段の写真：昭和11年(1936)頃撮影・中段の写真：平成23年撮影・下段の写真：昭和17年撮影 ◇◇ 大阪大学工学部(東野田学舎)は、大正10年に中之島から移転した大阪高等工業学校が、大阪工業大学を経て、昭和8年に大阪帝国大学工学部になったもので、昭和22年に新制の大阪大学となった。(写真は、昭和11年に建替えられた本館)。のち、大阪大学の吹田移転にともない、工学部も昭和46年に吹田キャンパスに移転した。その後跡地は、NTT西日本大阪研修センターと、昭和54年に移転開校した市立東高校となっている。,,,,,大阪大学工学部,,,,,,文化・観光/大阪の昔と今
271004,,大阪府,大阪市,鐘淵紡績淀川工場,カネガフチボウセキヨドガワコウジョウ,,,都島区友淵町1丁目,,34.7167772,135.5272948,,,,,,,上段の写真：大正13年撮影・中段の写真：平成23年撮影・下段の写真：昭和17年撮影 ◇◇ 大正7年に、友淵町に開業した鐘淵紡績淀川工場は、社宅などを含む広大な敷地で区内でも最大の工場であった。しかし、戦後の繊維不況などもあり、昭和49年に淀川工場は休止され、長浜工場に移転して、同57年には全面閉鎖された。跡地には、36階建超高層2棟を含む約3600戸の「ベルパーク・シティ」をはじめ、公団リバーサイドともぶち団地・公社友淵コーポ・市営友淵住宅や、友淵小学校・友淵中学校などが建設され、大規模な住宅地に転換されている。,,,,,鐘淵紡績淀川工場,,,,,,文化・観光/大阪の昔と今
271004,,大阪府,大阪市,市電都島車庫,シデンミヤコジマシャコ,,,都島区都島本通2丁目13,,34.7076801,135.5240299,,,,,,,上段の写真：昭和30年代撮影・中段の写真：平成23年撮影・下段の写真：昭和35年撮影 ◇◇ 市電都島車庫は、大正11年に桜の宮水源地跡に運輸事務所・変電所とともに建設されたが、昭和20年戦災により焼失する。翌年に縮小して再開するが、昭和44年の市電全廃に伴い都島車庫も廃止となった。跡地には平成5年、鉄骨鉄筋コンクリート造18階建の市立総合医療センターが開設された。総合医療センターは、既設の市立桃山病院・桃山市民病院・城北市民病院・母子センター・小児保健センターを統廃合して開設されたもので、高度専門医療機能を有する基幹病院である。,,,,,市電都島車庫,,,,,,文化・観光/大阪の昔と今
271004,,大阪府,大阪市,此花西部地区,コノハナセイブチク,,,此花区桜島2丁目,,34.6661758,135.4340127,,,,,,,上段の写真：昭和50年代撮影・中段の写真：平成23年撮影・下段の写真：昭和49年撮影 ◇◇ 此花区西部には西六社と呼ばれた巨大工場群があった。桜島地区には、明治33年に、大阪鉄工所の桜島造船場(のちの日立造船)が開業し、昭和になってからは、住友金属工業の工場も拡張された。しかしその後、産業構造の変化への対応の遅れから、大きな転換を迫られてきた。そんななか、このエリアを活用し、世界の人々を大阪に注目させる大プロジェクトとして、ユニバーサル・スタジオを核とするまちづくりが動き出す。平成7年、基盤整備のための此花西部臨海地区土地区画整理事業がスタートし、同13年には、「ユニバーサル・スタジオ・ジャパン(USJ)」が開業して、初年度1102万人をピークに年間約800万人で推移し、その後、イベント開催や人気アトラクションの導入によって増加し、多くの観客を集めている。,,,,,此花西部地区,,,,,,文化・観光/大阪の昔と今
271004,,大阪府,大阪市,塩水港製糖大阪工場,エンスイコウセイトウオオサカコウジョウ,,,此花区西九条6丁目1,,34.6800701,135.4613596,,,,,,,上段の写真：昭和初期撮影・中段の写真：平成23年撮影・下段の写真：昭和17年撮影 ◇◇ 塩水港製糖(昭和25年に塩水港精糖と改称)は、戦前は4大製糖の一つと称される大企業であった。塩水港製糖大阪工場は大正9年に開業され、煉瓦造4階建の工場建屋が並んでいたが、のち昭和48年に泉佐野市に移転した。跡地は大阪市が買収し、広場・グラウンドなどとして利用されていたが、平成20年に、中高一貫の市立咲くやこの花中学校・高校が開校している。,,,,,塩水港製糖大阪工場,,,,,,文化・観光/大阪の昔と今
271004,,大阪府,大阪市,関西電力春日出第２発電所,カンサイデンリョクカスガデダイニハツデンショ,,,此花区西九条7丁目,,34.6778802,135.4600101,,,,,,,上段の写真：昭和33年(1958)頃撮影・中段の写真：平成23年撮影・下段の写真：昭和35年撮影 ◇◇ 関西電力春日出第２発電所は、大正１１年に、大阪電灯春日出第２発電所として完成した。高さ70ｍの８本煙突が市民の目を引いていたが、昭和34年に建替えのため廃止され、煙突も姿を消した。同38年に新たに本格的な春日出発電所が完成したが、のち平成14年に廃止となって、翌年取り壊された。その後跡地には、ホームセンターのコーナンとディスカウントストアのラ・ムーの店舗が開業している。,,,,,関西電力春日出第２発電所,,,,,,文化・観光/大阪の昔と今
271004,,大阪府,大阪市,阪神野田踏切,ハンシンノダフミキリ,,,福島区海老江5丁目,,34.6945242,135.4743695,,,,,,,上段の写真：昭和33年(1958)撮影・中段の写真：平成23年撮影・下段の写真：昭和35年撮影 ◇◇ 阪神電鉄が野田駅西の国道2号と交差する野田阪神の踏切は、道路の中央で2つに分かれている遮断機があり、長く交通の難所となっていた。関係者の努力の結果、昭和32年、長年の懸案であった立体交差化のための高架工事に着手されることになる。昭和36年7月にまず上り線が、つづいて11月に下り線が開通し、翌年9月には全工事が完了して、大阪名物と言われた開かずの踏切が解消された。その後、昭和56年には、阪神電鉄高架と併行して阪神高速道路大阪西宮線の高架が完成している。,,,,,阪神野田踏切,,,,,,文化・観光/大阪の昔と今
271004,,大阪府,大阪市,川と住宅と煙突,カワトジュウタクトエントツ,,,福島区福島3丁目、北区中之島5丁目,,34.6898403,135.4856957,,,,,,,上段の写真：大正元年(1926)撮影・中段の写真：平成23年撮影・下段の写真：昭和17年撮影 ◇◇ かつて大阪は、「煙の都」「東洋のマンチェスター」と呼ばれ、工場の煙突が立ち並び黒煙をふきあげている市街地風景が、都心近くにもあった。この写真は、堂島川の玉江橋から福島・西九条・中之島・本田方面を写したものである(煤煙防止研究会大正元年会報掲載)。それから戦後の高度成長期まで、煤煙やスモッグによる公害問題は続く。いまの市街地風景は当時と全く様変わりし、中之島には大阪国際会議場・リーガロイヤルホテルなどの大規模な施設が並び、福島側には超高層マンションなどもそびえる。,,,,,川と住宅と煙突,,,,,,文化・観光/大阪の昔と今
271004,,大阪府,大阪市,大阪大学医学部付属病院,オオサカダイガクイガクブフゾクビョウイン,,,福島区福島1丁目1,,34.6943901,135.4896902,,,,,,,上段の写真：昭和48年(1973)撮影・中段の写真：平成23年撮影・下段の写真：昭和49年撮影 ◇◇ 大阪大学医学部附属病院は、老朽化した旧病院の建替えにより、昭和48年に9階建の新病院が完成した。その後、大阪大学の吹田キャンパス移転にともない、平成5年に附属病院も吹田に新築移転し、約70年にわたる堂島の立地にピリオドを打たれた。跡地のうち東側は、平成13年に検察庁などの24階建大阪中之島合同庁舎が、西側には、平成20年に朝日放送・多目的ホールや商業施設(堂島クロスウォーク、リバーフォーラム)、49階建超高層マンションなどの複合する「ほたるまち」が、水都大阪の新拠点として誕生している。,,,,,大阪大学医学部付属病院,,,,,,文化・観光/大阪の昔と今
271004,,大阪府,大阪市,中央卸売市場,チュウオウオロシウリシジョウ,,,福島区野田1丁目1,,34.6840547,135.4777119,,,,,,,上段の写真：昭和6年(1931)頃撮影・中段の写真：平成23年撮影・下段の写真：昭和17年撮影 ◇◇ 大阪市中央卸売市場は、水運・陸運などの条件から下福島を建設場所としたが、建設予定地には、多数の民家や、学校・伸銅所・倉庫などが密集、住民の反対運動や補償などで交渉は難航した。昭和6年に開場した市場は、敷地12haでその規模・設備はまさに東洋一であった。戦災により相当被害をうけるが、その後も施設の充実強化や拡張を進めてきた。さらに、平成2年からは、業務管理棟を手始めに、建替整備事業に着手し、3期にわたる工事が平成14年10月に完成して、市場は大きく生まれ変わった。,,,,,中央卸売市場,,,,,,文化・観光/大阪の昔と今
271004,,大阪府,大阪市,第一生命ビル,ダイイチセイメイビル,,,北区梅田1丁目8,,34.7006122,135.4966809,,,,,,,上段の写真：昭和28年(1953)撮影・中段の写真：平成23年撮影・下段の写真：昭和35年撮影 ◇◇ 大阪駅前の第一生命ビルは、12階建(軒高41m)の計画であったが、当時の建築基準法上の特例許可が必要となるため、9階建として見切り着工し昭和27年に一応完成したという。直後に許可を得て、昭和28年に12階建ビルが完成したもので、いわば当時の31m規制のもとでの特例による高層ビル第1号であった。その後、平成2年に建替えられ、現在は敷地東側に公開空地をとった19階建の大阪第一生命ビルディングとして、大阪駅のほぼ正面の位置に建つ。,,,,,第一生命ビル,,,,,,文化・観光/大阪の昔と今
271004,,大阪府,大阪市,大阪駅前市街地改造事業,オオサカエキマエシガイチカイゾウジギョウ,,,北区梅田1丁目,,34.6989652,135.4985499,,,,,,,上段の写真：昭和39年(1964)頃撮影・中段の写真：平成23年撮影・下段の写真：昭和42年撮影 ◇◇ 大阪駅前市街地改造事業は、当初予定していた土地区画整理事業の立体換地手法から、新たに法制化した市街地改造法の事業に切り替えて実施したものである。昭和36年に都市計画決定を行い、昭和40年に第1棟ビルに着工、西半分が同44年、東半分が同45年に完成、その後、当初計画の見直しとあわせ、第2～第4ビルに順次着工していく。こうして昭和58年5月、12階建・16階建・34階建・25階建、総延床42万㎡の4棟のビルが完成した。この20年に及ぶ事業によって、御堂筋から大きくセットバックしたオープンスペースが設けられるなど、大阪の表玄関にふさわしい都市景観が実現した。,,,,,大阪駅前市街地改造事業,,,,,,文化・観光/大阪の昔と今
