271004,,大阪府,大阪市,大阪城天守閣,オオサカジョウテンシュカク,,,中央区大阪城1丁目1番,,34.6872842,135.5258463,,,,,,,登録年月日：平成15年4月11日　概要：大阪城は、天正11年（1583年）豊臣秀吉により築かれたが、大坂夏の陣で焼失、堀も石垣も全て徳川幕府の手で作り直された。天守閣は、その後落雷により焼失したままであったが、昭和6年（1931年）、市民の寄付により豊臣秀吉創建時の姿に再建されたもので、鉄筋コンクリート造、外部5層、内部8層で、館内は秀吉と大阪城を中心とした歴史博物館として活用されている。平成9年（1997年）の大改修により美しい姿がよみがえっている。,,,,,大阪城天守閣,,,,,,文化・観光/都市景観資源
271004,,大阪府,大阪市,旧小西家住宅,キュウコニシケジュウタク,,,中央区道修町1丁目6番10号,,34.6886898,135.5067991,,,,,,,登録年月日：平成15年4月11日　概要：旧小西儀助商店（現コニシ株式会社）の旧店舗・住宅で、明治36年（1903年）に一部3階建で完成、堺筋の拡幅で西側が切り取られ、のち3階部分を撤去して現在の姿になった。船場に残る数少ない町屋の遺構のひとつとして、薬種問屋の形態を残した土蔵造り風の外観が特徴で、重要文化財に指定されている。内部は非公開。,,,,,旧小西家住宅,,,,,,文化・観光/都市景観資源
271004,,大阪府,大阪市,道頓堀グリコネオン,ドウトンボリグリコネオン,,,中央区道頓堀1丁目10番1号,,34.668857,135.5011788,,,,,,,登録年月日：平成15年4月11日　概要：昭和10年（1935年）に戎橋のそばに初めてグリコのネオン塔が立って以来、デザインが改良され、現在のもので5代目となる。高さ20ｍ、横幅約11ｍと大規模で、ランナーが大阪城や海遊館、大阪ドーム、通天閣を背景に大阪の街を走るデザインとなっている。日没30分前に点灯し、24時に消灯し、道頓堀川の水面に映し出されるネオンも名物のひとつとなっている。,,,,,道頓堀グリコネオン,,,,,,文化・観光/都市景観資源
271004,,大阪府,大阪市,生駒時計店（生駒ビルヂング）,イコマトケイテン（イコマビルヂング）,,,中央区平野町2丁目2番12号,,34.6875146,135.5063578,,,,,,,登録年月日：平成16年10月8日　概要：明治3年（1870年）に高麗橋5丁目で創業した生駒時計店が、御堂筋の拡幅と地下鉄工事を機に現在地に当ビルを新築。昭和5年（1930年）に竣工した。設計は宗兵藏。国の登録有形文化財に登録されている。,,,,,生駒時計店（生駒ビルヂング）,,,,,,文化・観光/都市景観資源
271004,,大阪府,大阪市,大阪倶楽部,オオサカクラブ,,,中央区今橋4丁目4番11号,,34.690984,135.4989278,,,,,,,登録年月日：平成16年10月8日　概要：大阪財界人によって経済都市大阪の進取的社交場として創設された社団法人大阪倶楽部の旧館が、大正11年（1922年）に焼失したあと、安井武雄の設計により大正13年（1924年）に再建された。国の登録有形文化財に登録されている。,,,,,大阪倶楽部,,,,,,文化・観光/都市景観資源
271004,,大阪府,大阪市,綿業会館,メンギョウカイカン,,,中央区備後町2丁目5番8号,,34.6854933,135.503896,,,,,,,登録年月日：平成16年10月8日　概要：東洋紡の役員であった岡恒夫の遺贈金と関係業界からの醸出金をもとに、綿業関係者の倶楽部会館として、昭和6年（1931年）に竣工した。設計は渡辺節。国の重要文化財に指定されている。,,,,,綿業会館,,,,,,文化・観光/都市景観資源
271004,,大阪府,大阪市,港大橋,ミナトオオハシ,,,港区海岸通3丁目・住之江区南港東9丁目間,,34.6444272,135.4379345,,,,,,,登録年月日：平成15年4月11日　概要：昭和49年（1974年）に完成した最大支間長510ｍのダブルデッキ形式のゲルバートラス橋で、阪神高速道路に架けられた橋の中で最も長い支間長を持ち、トラス橋としては世界第3位の規模を誇っている。また、橋下を4万トン級の大型コンテナ船が航行できるよう、海面から桁下までは50ｍ以上の空間が確保されている。そのスケールや色彩、重量感から、大阪港のランドマークになっている。,,,,,港大橋,,,,,,文化・観光/都市景観資源
271004,,大阪府,大阪市,一心寺,イッシンジ,,,天王寺区逢坂2丁目8番69号,,34.6530481,135.5108179,,,,,,,登録年月日：平成15年4月11日　概要：約800年前に法然上人が、四天王寺の西、海に沈む夕陽が望めるあたりに造った草庵が一心寺のはじまりで、骨仏の寺として全国的に有名。昭和20年（1945年）、戦災によりほとんど焼失したが、その後、昭和41年（1966年）には本堂が再建され、その後も念仏堂・山門など伽藍の再興が進められている。,,,,,一心寺,,,,,,文化・観光/都市景観資源
271004,,大阪府,大阪市,総本山四天王寺,ソウホンザンシテンノウジ,,,天王寺区四天王寺1丁目11番18号,,34.6552594,135.5174064,,,,,,,登録年月日：平成15年4月11日　概要：四天王寺は、推古天皇元年（593年）聖徳太子により創建された日本最古の官寺で、南北一列に並ぶ伽藍配置は四天王寺様式と呼ばれる。たびたびの戦火や災害にあたってきたが、西門の石鳥居や、元和9年（1623年）再建の六時堂・五智光院・本坊方丈などは重要文化財に指定されており、中心伽藍は昭和38年（1963年）に鉄筋コンクリート造で再建が完成した。,,,,,総本山四天王寺,,,,,,文化・観光/都市景観資源
271004,,大阪府,大阪市,通天閣,ツウテンカク,,,浪速区恵美須東1丁目18番6号,,34.6525337,135.5063874,,,,,,,登録年月日：平成15年4月11日　概要：通天閣は、明治45年（1912年）内国勧業博の会場跡に新世界・ルナパークとともに完成。昭和18年（1943年）火災にあい、鉄材供出により解体され姿を消したが、地元の熱い思いを受けて、昭和31年に2代目通天閣が再建された。高さ103ｍ、円形エレベーター、展望台が設置されており、平成8年（1996年）の改修によりリニューアルされたネオンは、交通安全の標語、天気予報にも活用されている。,,,,,通天閣,,,,,,文化・観光/都市景観資源
271004,,大阪府,大阪市,菅原城北大橋,スガハラシロキタオオハシ,,,東淀川区豊里1丁目・旭区生江3丁目間,,34.7347419,135.5356074,,,,,,,登録年月日：平成15年4月11日　概要：大阪市で最初に有料道路の事業を取り入れて平成元年に完成した斜張橋で、普通車の通行料が100円であることから、百円橋と呼ばれ親しまれている。2つのタワーが他本数のケーブルに力を分散して支えている姿が美しい。この橋が架かる淀川には、ヨシ原や天然記念物のイタセンパラの棲むワンドがあり、建設にあたってはこれらの保全に配慮された。また城北公園の中を通るため景観面で数々の検討がなされた。,,,,,菅原城北大橋,,,,,,文化・観光/都市景観資源
271004,,大阪府,大阪市,水道記念館（旧柴島浄水場第1配水ポンプ場）,スイドウキネンカン（キュウクニジマジョウスイジョウダイイチハイスイポンプジョウ）,,,東淀川区柴島1丁目3番1号,,34.7244015,135.5054031,,,,,,,登録年月日：平成16年10月8日　概要：水道記念館の建物は、宗兵藏の設計で、大正3年（1914年）に竣工。市勢発展による人口急増に伴う給水量を確保するため、明治41年（1897年）から始まった第2回水道拡張事業において建てられた送水ポンプ場「旧第1配水ポンプ場」の建物を保存活用した記念館。国の登録有形文化財に登録されている。,,,,,水道記念館（旧柴島浄水場第1配水ポンプ場）,,,,,,文化・観光/都市景観資源
271004,,大阪府,大阪市,花博記念公園鶴見緑地,ハナハクキネンコウエンツルミリョクチ,,,鶴見区緑地公園他,,34.7118339,135.5787373,,,,,,,登録年月日：平成16年10月8日　概要：戦前に過密都市対策の一環として計画された大阪を代表する四大緑地のひとつ。平成2年（1990年）に国際花と緑の博覧会の開催後、再整備された都市公園。面積約120haという広大な敷地は造成によって変化のある自然景観を形成。博覧会の開催に合わせて地下鉄が整備され、また、公園に隣接してUNEP国際環境技術センターなどの施設も整備された。,,,,,花博記念公園鶴見緑地,,,,,,文化・観光/都市景観資源
271004,,大阪府,大阪市,宗教法人住吉大社,シュウキョウホウジンスミヨシタイシャ,,,住吉区住吉2丁目9番89号,,34.6129193,135.4930306,,,,,,,登録年月日：平成15年4月11日　概要：草創は神功皇后の海外渡航時の安全祈願の故事に由来すると伝えられるが、現在の本殿4棟は、文化5年（1808年）造営されたもので、桧皮葺き・切妻造り妻入りの住吉造りと称され、市内唯一の国宝建造物である。境内には、慶長11年（1606年）に架設され住吉大社の象徴ともいえる朱塗りの太鼓橋（反橋）をはじめ、重要文化財の石舞台や南門・東西楽所などや、全国から献灯された石灯ろう600余基などもある。,,,,,宗教法人住吉大社,,,,,,文化・観光/都市景観資源
271004,,大阪府,大阪市,杭全神社,クマタジンジャ,,,平野区平野宮町2丁目1番67号,,34.6282318,135.5548136,,,,,,,登録年月日：平成16年10月8日　概要：平安時代の初め、貞観4年（862年）に坂上廣野麿の子當道が、氏神を祭ったのが始まりとされる神社である。社殿のうち第二殿・第三殿は、永正10年（1513年）造営の記録があり、第一殿とあわせて国の重要文化財に、全国で唯一の連歌所は市の指定文化財に、また、境内のクスノキとイチョウが市の保存樹にそれぞれ指定されている。,,,,,杭全神社,,,,,,文化・観光/都市景観資源
271004,,大阪府,大阪市,大念佛寺,ダイネンブツジ,,,平野区平野上町1丁目7番26号,,34.6272745,135.5505138,,,,,,,登録年月日：平成16年10月8日　概要：融通念仏宗の総本山で、大治2年（1127年）に聖応大師（良忍上人）が開基したと伝えられている。明治31年（1898年）に火災があり本堂以下多数の堂宇を失った。現在の本堂は昭和13年（1938年）に竣工した大阪府内最大の木造建築物で、国の登録有形文化財に登録されている。また、境内のクスノキとイチョウが市の保存樹に指定されている。,,,,,大念佛寺,,,,,,文化・観光/都市景観資源
271004,,大阪府,大阪市,深江郷土資料館,フカエキョウドシリョウカン,,,東成区深江南3-16-14,,34.6699161,135.5609237,,,,,,,,,,,,深江郷土資料館,06-6977-5555,,,,,文化・観光/美術館・博物館
271004,,大阪府,大阪市,花川墓地,ハナカワボチ,,,大阪市西淀川区柏里２丁目１０番,,34.7097666,135.4665184,,,,,,,,,,,,花川墓地,,,,,,文化・観光/その他施設
271004,,大阪府,大阪市,安治川,アジガワ,,,西区川口2丁目、福島区野田1丁目～港区弁天6丁目、此花区西九条7丁目地先,,34.6835287,135.4801218,,,,,,,貞享元年（1684年）、幕府の命を受けた河村瑞賢によって開削された。その結果、大阪の街の中心へ船の出入りが容易になり大阪の発展に寄与した。河川の両岸には、舟運が盛んだったころを偲ばせる工場や倉庫などが建ち並び、「大阪港開港の地」の碑をはじめ、多くの石碑が存在している。,,,,,安治川,,,,,,文化・観光/都市景観資源
271004,,大阪府,大阪市,靱公園,ウツボコウエン,,,西区靭本町1丁目、2丁目,,34.6854973,135.4941032,,,,,,,昭和30年（1955年）開園。なにわ筋を挟んで東西に分かれている。東園には、バラ園や四季に彩られるケヤキ並木などがある。バラ園はゆるやかに起伏する地形を生かして、東から西に向かって山、里山、田園、街と広がる「大阪のマチ構造」を表現し、平成16年（2004年）に再整備された。西園には国際大会にも利用できる靱テニスセンターがある。,,,,,靱公園,,,,,,文化・観光/都市景観資源
271004,,大阪府,大阪市,江戸堀コダマビル,エドボリコダマビル,,,西区江戸堀1丁目10番26号,,34.6896124,135.4954002,,,,,,,昭和10年（1935年）個人の邸宅として建設。設計・施工はヴォーリズ建築を手がけた岡本工務店でファサードに特色がある。建設当時、敷地の南には江戸堀川が流れ、窓から川面が見えていた。現在は、物販店や貸会議室、音楽室などとして活用されている。国の登録有形文化財に登録されている。,,,,,江戸堀コダマビル,,,,,,文化・観光/都市景観資源
271004,,大阪府,大阪市,大阪アドプト・リバー・千代崎（木津川右岸）,オオサカアドプト・リバー・チヨザキ（キヅガワウガン））,,,西区千代崎2丁目、3丁目地先,,34.6715526,135.4799332,,,,,,,水の都大阪再生構想の一環として大阪府により木津川右岸に船着場と遊歩道が整備された。それに伴い、平成17年（2005年）、千代崎連合振興町会と大阪府との間でアドプトリバー・プログラム協定が締結され、本区間は美化・清掃活動により美しい景観が保たれている。,,,,,大阪アドプト・リバー・千代崎（木津川右岸）,,,,,,文化・観光/都市景観資源
271004,,大阪府,大阪市,旧岩崎運河,キュウイワサキウンガ,,,西区千代崎3丁目、大正区三軒家西1丁目、2丁目地先,,34.6673051,135.4742671,,,,,,,木津川と尻無川を結ぶ長さ560ｍの運河。尻無川が大型船の航行に不向きであったため、尻無川と木津川を結ぶために大正9年（1920年）に開削された。下流には、昭和3年（1928年）に岩崎運河橋梁が架けられ、ＪＲ環状線の一部となっている。右岸には、岩崎橋地区の開発に合わせて親水性の高い空間が整備されている。なお、現在は木津川分派点から旧岩崎運河を含む河口までが尻無川である。,,,,,旧岩崎運河,,,,,,文化・観光/都市景観資源
271004,,大阪府,大阪市,京セラドーム大阪,キョウセラドームオオサカ,,,西区千代崎3丁目,,34.6690373,135.476138,,,,,,,平成9年（1997年）にオープンした全天候型の多目的ドーム。アリーナ上部の大屋根の外周に、さらに小型の屋根が取り囲むようにうねりながら続いている点が特徴的。プロ野球やスポーツイベント、文化イベントなど、年間を通じて各種イベント等に活用されている。,,,,,京セラドーム大阪,,,,,,文化・観光/都市景観資源
271004,,大阪府,大阪市,島谷家住宅,シマタニケジュウタク,,,西区本田4丁目9番3号,,34.6787866,135.4721785,,,,,,,本田4丁目には戦災を逃れた長屋の街並みが残っている。その一角にある長屋住宅では、１階に格子の玄関や出格子の窓が見られ、１階屋根と2階屋根の間にうだつが上がっている。,,,,,島谷家住宅,,,,,,文化・観光/都市景観資源
271004,,大阪府,大阪市,菅澤眼科クリニック,スガサワガンカクリニック,,,西区土佐堀2丁目3番5号,,34.6883493,135.4900116,,,,,,,昭和３年（1928年）に建築、昭和22年（1947年）に改修された眼科医院。正面玄関の柱とアーチ、ドイツから輸入されたタイル貼りの外壁、細長いアーチ窓が特徴的である。,,,,,菅澤眼科クリニック,,,,,,文化・観光/都市景観資源
271004,,大阪府,大阪市,道頓堀川水門,ドウトンボリガワスイモン,,,西区南堀江4丁目、浪速区幸町3丁目,,34.6689398,135.4813864,,,,,,,平成12年度（2001年3月）完成。東横堀川水門とあわせ、高潮防御機能、水質浄化機能、舟運活性化機能などの役割を果たしている。木津川の対岸にある岩崎橋地区の景観に配慮した設計となっており、近未来的な外観デザインが特徴的である。,,,,,道頓堀川水門,,,,,,文化・観光/都市景観資源
271004,,大阪府,大阪市,長瀬産業大阪本社ビル本館,ナガセサンギョウオオサカホンシャビルホンカン,,,西区新町1丁目1番17号,,34.6784723,135.4974281,,,,,,,昭和3年（1928年）竣工。設計者は初代通天閣を設計した設楽貞雄。中央のバルコニーが特徴的で、外壁はスクラッチタイルを使用している。新館が昭和57年（1982年）に建てられているが、そのデザインは、立面の構成や窓の配列など旧館へ配慮している。,,,,,長瀬産業大阪本社ビル本館,,,,,,文化・観光/都市景観資源
271004,,大阪府,大阪市,日本聖公会川口基督教会,ニホンセイコウカイカワグチキリストキョウカイ,,,西区川口1丁目3番8号,,34.6821585,135.4821821,,,,,,,煉瓦造の聖堂は大正9年（1920年）に竣工。設計者は建築家ウィリアム・ウィルソン。東側に玄関ホールを設け、東南角に高さ19mの搭屋を構える。平成7年（1995年）の阪神・淡路大震災で大きな被害を受けたが、関係者の熱意により修復された。,,,,,日本聖公会川口基督教会,,,,,,文化・観光/都市景観資源
271004,,大阪府,大阪市,安治川水門,アジガワスイモン,,,港区弁天6丁目,,34.6756399,135.4561375,,,,,,,大阪ではジェーン台風や第2室戸台風など高潮による大きな被害を受けてきたことから、その対策として、昭和45年（1970年）に建設された。耐震、耐風の安全性や、船舶航行時の必要上部空間を確保出来ることからアーチ型水門（幅57ｍ）が採用された。,,,,,安治川水門,,,,,,文化・観光/都市景観資源
271004,,大阪府,大阪市,大阪市築港赤レンガ倉庫,オオサカシチッコウアカレンガソウコ,,,港区海岸通2丁目6番1号,,34.6514545,135.4368349,,,,,,,大正12年（1923年）、住友倉庫により港湾倉庫として建設。港区では空襲にも焼け残った数少ない建造物。現在は大阪市が管理している。耐震上の問題から閉鎖しているが、広く市民に親しんでいただけるよう隣接する広場を開放するなど、今後とも倉庫の活用に向けた検討を行うこととしている。,,,,,大阪市築港赤レンガ倉庫,,,,,,文化・観光/都市景観資源
271004,,大阪府,大阪市,桜通り,サクラドオリ,,,港区磯路3丁目～弁天3丁目,,34.6642825,135.4571387,,,,,,,桜通りには、南北800ｍに渡ってソメイヨシノとサトザクラが植えられている。桜並木は、地域住民により植えられ、管理されているもので、港区の桜の名所となっている。桜の開花時期には地元愛護会によりぼんぼりが飾られる。,,,,,桜通り,,,,,,文化・観光/都市景観資源
271004,,大阪府,大阪市,桜通り,,,,港区磯路3丁目～弁天3丁目,,34.6642825,135.4571387,,,,,,,桜通りには、南北800ｍに渡ってソメイヨシノとサトザクラが植えられている。桜並木は、地域住民により植えられ、管理されているもので、港区の桜の名所となっている。桜の開花時期には地元愛護会によりぼんぼりが飾られる。,,,,,桜通り,,,,,,文化・観光/都市景観資源
271004,,大阪府,大阪市,北中道の古い街並み,キタナカミチノフルイマチナミ,,,東成区中道4丁目16番、17番,,34.6742451,135.538869,,,,,,,かつて平野川と暗越奈良街道とが交差する玉津橋は、交通の要所として賑わっていた。玉津橋西詰を北に入ると、通りの両側に蔵や板塀のある民家が連続しており、古い街並みを形成している。,,,,,北中道の古い街並み,,,,,,文化・観光/都市景観資源
271004,,大阪府,大阪市,旧三井釦被服,キュウミツイボタンヒフク,,,東成区大今里4丁目27番22号,,34.6678326,135.5486873,,,,,,,今里周辺には明治中期から大正にかけてボタンや被服の製造に携わる事業者が数多く存在した。そのなかで三井釦被服は最も大きな事業者であった。この建物は、昭和初期に軍の要請で四条畷市に青年学校校舎として建てられたが、青年学校校舎としては使用されず、小学校仮校舎として使用され、戦後になってから現在の地に移築したといわれる。移設当時から被服製品の販売を行っていたが、後に改装して用途の転用を図っている。移築当時は、左右対称の建物であったが、左側部分が取り壊され、非対称となっている。,,,,,旧三井釦被服,,,,,,文化・観光/都市景観資源
271004,,大阪府,大阪市,真言宗御室派密華山妙法寺,シンゴンシュウオムロハミッケザンミョウホウジ,,,東成区大今里4丁目16番50号,,34.669031,135.548083,,,,,,,聖徳太子の創建と伝えられる。石山合戦で焼失した本堂は、享保年間（1716年頃）に再建された。近世国学の祖と言われる契沖が、延宝7年（1679）から元禄3年（1690）まで住職を務め、ここで「万葉代匠記」を記したといわれ、境内は大阪府の史跡に指定されている。,,,,,真言宗御室派密華山妙法寺,,,,,,文化・観光/都市景観資源
271004,,大阪府,大阪市,玉津の昭和初期の街並み,タマヅノショウワショキノマチナミ,,,東成区玉津3丁目2番,,34.6668851,135.5365008,,,,,,,玉津周辺は、映画「血と骨」の舞台となった場所である。映画に出てくる市電「大成通一丁目」停車場（昭和44年（1969年）廃止）の周辺には、サンデー毎日創刊時からの看板、昭和8年（1933年）創業の食堂など昭和初期の街並みが残っている。,,,,,玉津の昭和初期の街並み,,,,,,文化・観光/都市景観資源
271004,,大阪府,大阪市,八王子神社御旅所の楠,ハチオウジジンジャオタビショノクスノキ,,,東成区大今里1丁目17番10号,,34.6731975,135.5453995,,,,,,,八王子神社御旅所の楠は、樹齢1300年を数えるとされ、明治18年（1886年）の洪水の際には、楠の上に、いかだを組んで難を逃れたという言い伝えがある。幹周11m、樹高25mで、大阪市の保存樹に指定されている。八王子神社御旅所は、この樹の見事さから楠神社とも呼ばれている。,,,,,八王子神社御旅所の楠,,,,,,文化・観光/都市景観資源
271004,,大阪府,大阪市,東小橋の街並み,ヒガシオバセノマチナミ,,,東成区東小橋3丁目6番～9番,,34.6667443,135.5341191,,,,,,,東小橋にある比賣許曽神社の歴史は古く、古事記では新羅から渡来した赤留比売命を祀ったと記され、石山合戦の兵火にあい、現在の地に移ったとされている。比賣許曽神社の周辺は、かつて江戸時代・明治時代の東小橋村の中心であった。現在でも、比賣許曽神社のほか、安楽寺、格子のある民家など、戦災から逃れた昔の街並みが残っている。,,,,,東小橋の街並み,,,,,,文化・観光/都市景観資源
271004,,大阪府,大阪市,火袋式道標,ヒブクロシキドウヒョウ,,,東成区大今里4丁目27番,,34.6677517,135.5491434,,,,,,,暗越奈良街道と千日前通が交差する場所に立つ道標。上部を四角にくりぬいて火袋とし、上に笠をのせた形状をしている。文化3年（1806年）に釘問屋が建てたといわれており、道標には「右志き山、八尾久宝寺道　左いせ、なら道」と示されている。,,,,,火袋式道標,,,,,,文化・観光/都市景観資源
